<?xml version="1.0" encoding="UTF-8"?>
<!DOCTYPE dataset SYSTEM "uds-dataset.dtd">
<dataset>
	<USER_ACCOUNT ID="1" LOGIN="joe" CREATION_MODE="auto" PASSWORD_HASH="993bd037c1ae6b87ea5adb936e71fca01a3b5c0505855444afdfa2f86405db1d"/> <!-- proline_pswd -->
	<USER_ACCOUNT ID="2" LOGIN="jack" CREATION_MODE="auto" PASSWORD_HASH="993bd037c1ae6b87ea5adb936e71fca01a3b5c0505855444afdfa2f86405db1d"/> <!-- proline_pswd -->
	<USER_ACCOUNT ID="3" LOGIN="jim" CREATION_MODE="auto" PASSWORD_HASH="993bd037c1ae6b87ea5adb936e71fca01a3b5c0505855444afdfa2f86405db1d"/> <!-- proline_pswd -->
	<PROJECT ID="1" NAME="joe's project" DESCRIPTION="joe's first project" CREATION_TIMESTAMP="2011-03-24 12:00:30" OWNER_ID="1" />
	<PROJECT_USER_ACCOUNT_MAP PROJECT_ID="1" USER_ACCOUNT_ID="1" />
	<PROJECT_USER_ACCOUNT_MAP PROJECT_ID="1" USER_ACCOUNT_ID="2" />
	<INSTRUMENT ID="1" SOURCE="ESI" NAME="VENUS"/>
	<VIRTUAL_FOLDER ID="1" PROJECT_ID="1" PATH="" NAME="Meetins"/>
	<VIRTUAL_FOLDER ID="2" PROJECT_ID="1" PARENT_VIRTUAL_FOLDER_ID="1" NAME="Boston"/>
	<VIRTUAL_FOLDER ID="3" PROJECT_ID="1" PATH="" NAME="Accessions lists"/>
	<OBJECT_TREE_SCHEMA SCHEMA="no schema" VERSION="1.0" NAME="text/csv" TYPE="csv"/>
	<OBJECT_TREE ID="1" SERIALIZED_DATA="HS90B_HUMAN,Heat shock protein HSP 90-beta,12589" SCHEMA_NAME="text/csv"/>
	<DOCUMENT ID="1" PROJECT_ID="1" SCHEMA_NAME="text/csv" CREATION_TIMESTAMP="2011-04-02 12:00:30" VIRTUAL_FOLDER_ID="3" NAME="S1_Proteins" DESCRIPTION="List of proteins (accession) identified in Sample 1 (S1)" OBJECT_TREE_ID="1"/>
	<RAW_FILE NAME="CAVEN456" OWNER_ID="1" INSTRUMENT_ID="1" EXTENSION="raw"/>
	<RAW_FILE NAME="CAVEN457" OWNER_ID="1" INSTRUMENT_ID="1" EXTENSION="raw"/>
	<RUN ID="1" RAW_FILE_NAME="CAVEN456" RUN_START="5" DURATION="85" RUN_STOP="90" NUMBER="1"/>
	<RUN ID="2" RAW_FILE_NAME="CAVEN457" RUN_START="5" DURATION="85" RUN_STOP="90" NUMBER="1"/>
	
	
	<DATA_SET NAME="CB_342" ID="1" PROJECT_ID="1" NUMBER="1" CHILDREN_COUNT="2" CREATION_TIMESTAMP="2011-03-24 14:00:30" TYPE="AGGREGATE"/>
	<DATA_SET NAME="CB_342_1" ID="2" PROJECT_ID="1" NUMBER="1" CHILDREN_COUNT="0" CREATION_TIMESTAMP="2011-03-24 15:00:30" TYPE="IDENTIFICATION" RESULT_SET_ID="789" RESULT_SUMMARY_ID="124" PARENT_DATASET_ID="1"/>
    <DATA_SET NAME="CB_342_2" ID="3" PROJECT_ID="1" NUMBER="1" CHILDREN_COUNT="0" CREATION_TIMESTAMP="2011-03-24 15:20:30" TYPE="IDENTIFICATION" RESULT_SET_ID="790" RESULT_SUMMARY_ID="125" PARENT_DATASET_ID="1"  />
    <RUN_IDENTIFICATION ID="2" RAW_FILE_NAME="CAVEN456" RUN_ID="1" />
    <RUN_IDENTIFICATION ID="3"  RAW_FILE_NAME="CAVEN457" RUN_ID="2"/>  
	
	<EXTERNAL_DB IS_BUSY="false"  VERSION="A.0.1" ID="1" TYPE="PDI"  USERNAME="sa" PASSWORD="myPass" NAME="pdi_test" CONNECTION_MODE="MEMORY"/>
	<EXTERNAL_DB IS_BUSY="false"  VERSION="A.0.1" ID="2" TYPE="PS"  USERNAME="sa" PASSWORD="myPass" NAME="ps_test" CONNECTION_MODE="MEMORY" />
	<EXTERNAL_DB IS_BUSY="false"  VERSION="A.0.1" ID="3" TYPE="MSI"  USERNAME="sa" PASSWORD="myPass" NAME="msi_test" CONNECTION_MODE="MEMORY" />
	<PROJECT_DB_MAP EXTERNAL_DB_ID="3" PROJECT_ID="1" />

	<!-- Needed for ResultSet Storer / ResultSetFakeBuilder test -->
	<SPEC_TITLE_PARSING_RULE ID="1" RAW_FILE_NAME="(.+)\.\d+\.\d+\.\d+\.dta" FIRST_SCAN=".+\.(\d+)\.\d+\.\d+\.dta" LAST_SCAN=".+\.\d+\.(\d+)\.\d+\.dta" NAME="extract_msn.exe"/>
	<SPEC_TITLE_PARSING_RULE ID="2" RAW_FILE_NAME="^File: (.+?)," FIRST_CYCLE="Cycle\(s\): (\d+) \(Experiment \d+\)|Cycle\(s\): (\d+), \d+" LAST_CYCLE="Cycle\(s\): (\d+) \(Experiment \d+\)|Cycle\(s\): \d+, (\d+)" FIRST_TIME="Elution: (.+?) to .+? min|Elution: (.+?) min" LAST_TIME="Elution: .+? to (.+?) min|Elution: (.+?) min" NAME="mascot.dll"/>
	<SPEC_TITLE_PARSING_RULE ID="3" RAW_FILE_NAME="\[(.+?)\]" FIRST_CYCLE="(\d+?) \(rt=" LAST_CYCLE="- \d+: Scan (\d+?) \(rt=" FIRST_TIME="\(rt=(\d+?\.\d+?)\)" LAST_TIME="-.+Scan \d+ \(rt=(\d+\.\d+)" NAME="Mascot Distiller"/>
	<SPEC_TITLE_PARSING_RULE ID="4" RAW_FILE_NAME="^RawFile: (.+?) FinneganScanNumber:" FIRST_SCAN="FinneganScanNumber: (\d+)" LAST_SCAN="FinneganScanNumber: (\d+)" NAME="MaxQuant"/>
	<SPEC_TITLE_PARSING_RULE ID="5" FIRST_SCAN="Spectrum\d+\s+scans:(\d+?)," LAST_SCAN="Spectrum\d+\s+scans:(\d+?)," NAME="Proteome Discoverer"/>
	<SPEC_TITLE_PARSING_RULE ID="6" FIRST_SCAN="scan=(\d+)" LAST_SCAN="scan=(\d+)" NAME="ProteoWizard 2.0"/>
	<SPEC_TITLE_PARSING_RULE ID="7" RAW_FILE_NAME="(.+)\.\d+\.\d+\.\d+$" FIRST_SCAN=".+\.(\d+)\.\d+\.\d+$" LAST_SCAN=".+\.\d+\.(\d+)\.\d+$" NAME="ProteoWizard 2.1"/>
	<SPEC_TITLE_PARSING_RULE ID="8" FIRST_TIME="Cmpd.+MS.+, (\d+\.\d+)(?:-\d+\.\d+)? min" LAST_TIME="Cmpd.+MS.+, (?:\d+\.\d+-)?(\d+\.\d+) min" NAME="Spectrum Mill/Bruker"/>
	<PEAKLIST_SOFTWARE ID="1" NAME="extract_msn.exe" SPEC_TITLE_PARSING_RULE_ID="1"/>
	<PEAKLIST_SOFTWARE ID="2" NAME="mascot.dll" SPEC_TITLE_PARSING_RULE_ID="2"/>
	<PEAKLIST_SOFTWARE ID="3" NAME="Mascot Distiller" SPEC_TITLE_PARSING_RULE_ID="3"/>
	<PEAKLIST_SOFTWARE ID="4" NAME="MaxQuant" SPEC_TITLE_PARSING_RULE_ID="4"/>
	<PEAKLIST_SOFTWARE ID="5" NAME="Proteome Discoverer" SPEC_TITLE_PARSING_RULE_ID="5"/>
	<PEAKLIST_SOFTWARE ID="6" NAME="ProteoWizard" VERSION="2.0" SPEC_TITLE_PARSING_RULE_ID="6"/>
	<PEAKLIST_SOFTWARE ID="7" NAME="ProteoWizard" VERSION="2.1" SPEC_TITLE_PARSING_RULE_ID="7"/>
	<PEAKLIST_SOFTWARE ID="8" NAME="Spectrum Mill/Bruker" SPEC_TITLE_PARSING_RULE_ID="8"/>


	<ACTIVATION TYPE="CID"/>
	<INSTRUMENT_CONFIG ID="1" MS1_ANALYZER="Analyzer" NAME="VENUS_CFG" ACTIVATION_TYPE="CID" INSTRUMENT_ID="1" />

	<ENZYME ID="1" IS_SEMI_SPECIFIC="false" IS_INDEPENDANT="true" NAME="Trypsin" />
	<ENZYME ID="2" IS_SEMI_SPECIFIC="true" IS_INDEPENDANT="true" NAME="Trypsin/P" />


</dataset>
