<?xml version="1.0" encoding="UTF-8"?>
<!DOCTYPE dataset SYSTEM "../../../../../uds-dataset.dtd">
<dataset>
	<USER_ACCOUNT ID="1" LOGIN="joe" CREATION_MODE="auto"/>
	<USER_ACCOUNT ID="2" LOGIN="jack" CREATION_MODE="auto"/>
	<USER_ACCOUNT ID="3" LOGIN="jim" CREATION_MODE="auto"/>
	<PROJECT ID="1" NAME="joe's project" DESCRIPTION="joe's first project" CREATION_TIMESTAMP="2011-03-24 12:00:30" OWNER_ID="1" />
	<PROJECT_USER_ACCOUNT_MAP PROJECT_ID="1" USER_ACCOUNT_ID="1" />
	<PROJECT_USER_ACCOUNT_MAP PROJECT_ID="1" USER_ACCOUNT_ID="2" />
	<INSTRUMENT ID="1" SOURCE="ESI" NAME="VENUS"/>
	<VIRTUAL_FOLDER ID="1" PROJECT_ID="1" PATH="" NAME="Meetins"/>
	<VIRTUAL_FOLDER ID="2" PROJECT_ID="1" PARENT_VIRTUAL_FOLDER_ID="1" NAME="Boston"/>
	<VIRTUAL_FOLDER ID="3" PROJECT_ID="1" PATH="" NAME="Accessions lists"/>
	<OBJECT_TREE_SCHEMA SCHEMA="no schema" VERSION="1.0" NAME="text/csv" TYPE="csv"/>
	<OBJECT_TREE ID="1" SERIALIZED_DATA="HS90B_HUMAN,Heat shock protein HSP 90-beta,12589" SCHEMA_NAME="text/csv"/>
	<DOCUMENT ID="1" PROJECT_ID="1" SCHEMA_NAME="text/csv" CREATION_TIMESTAMP="2011-04-02 12:00:30" VIRTUAL_FOLDER_ID="3" NAME="S1_Proteins" DESCRIPTION="List of proteins (accession) identified in Sample 1 (S1)" OBJECT_TREE_ID="1"/>
	<RAW_FILE NAME="CAVEN456" OWNER_ID="1" INSTRUMENT_ID="1" EXTENSION="raw"/>
	<RAW_FILE NAME="CAVEN457" OWNER_ID="1" INSTRUMENT_ID="1" EXTENSION="raw"/>
	<RUN ID="1" RAW_FILE_NAME="CAVEN456" RUN_START="5" DURATION="85" RUN_STOP="90" NUMBER="1"/>
	<RUN ID="2" RAW_FILE_NAME="CAVEN457" RUN_START="5" DURATION="85" RUN_STOP="90" NUMBER="1"/>
	<IDENTIFICATION NAME="CB_342" ID="1" PROJECT_ID="1" NUMBER="1" FRACTION_COUNT="2" CREATION_TIMESTAMP="2011-03-24 14:00:30" />
	<IDENTIFICATION_FRACTION ID="1" NUMBER="1" IDENTIFICATION_ID="1" RESULT_SET_ID="789" RAW_FILE_NAME="CAVEN456" RUN_ID="1"/>
	<IDENTIFICATION_FRACTION ID="2" NUMBER="2" IDENTIFICATION_ID="1" RESULT_SET_ID="790" RAW_FILE_NAME="CAVEN457" RUN_ID="2"/>
	<IDENTIFICATION_SUMMARY ID="1" NUMBER="1" IDENTIFICATION_ID="1" RESULT_SUMMARY_ID="123"/>
	<IDENTIFICATION_FRACTION_SUMMARY ID="1" IDENTIFICATION_FRACTION_ID="1" RESULT_SUMMARY_ID="124" IDENTIFICATION_SUMMARY_ID="1"/>
	<IDENTIFICATION_FRACTION_SUMMARY ID="2" IDENTIFICATION_FRACTION_ID="2" RESULT_SUMMARY_ID="125" IDENTIFICATION_SUMMARY_ID="1"/>
	<EXTERNAL_DB IS_BUSY="false"  VERSION="A.0.1" ID="1" TYPE="PDI"  USERNAME="" PASSWORD="" NAME="pdi_sqlite_shared_memory.lock:pdi_test?mode=memory&amp;cache=shared" CONNECTION_MODE="FILE"/>
	<EXTERNAL_DB IS_BUSY="false"  VERSION="A.0.1" ID="2" TYPE="PS"  USERNAME="" PASSWORD="" NAME="ps_sqlite_shared_memory.lock:ps_test?mode=memory&amp;cache=shared" CONNECTION_MODE="FILE" />
	<EXTERNAL_DB IS_BUSY="false"  VERSION="A.0.1" ID="3" TYPE="MSI"  USERNAME="" PASSWORD="" NAME="msi_sqlite_shared_memory.lock:msi_test?mode=memory&amp;cache=shared" CONNECTION_MODE="FILE" />
	<PROJECT_DB_MAP EXTERNAL_DB_ID="3" PROJECT_ID="1" />

	<!-- Needed for ResultSet Storer / ResultSetFakeBuilder test -->
	<SPEC_TITLE_PARSING_RULE ID="1" NAME="ZZZ Distiller TEST" />
	<PEAKLIST_SOFTWARE ID="1"  VERSION="4.3.2" NAME="Distiller" SPEC_TITLE_PARSING_RULE_ID="1" />


	<ACTIVATION TYPE="1"/>
	<INSTRUMENT_CONFIG ID="1" MS1_ANALYZER="Analyzer" NAME="VENUS_CFG" ACTIVATION_TYPE="1" INSTRUMENT_ID="1" />

	<ENZYME ID="1" IS_SEMI_SPECIFIC="false" IS_INDEPENDANT="true" NAME="TRYPSIC" />
	<ENZYME ID="2" IS_SEMI_SPECIFIC="true" IS_INDEPENDANT="true" NAME="Trypsin/P" />


</dataset>
